{
  "id": "stm32f722ret6",
  "vendor": "STMicroelectronics",
  "family_id": "stm32-f7",
  "series": "STM32F7",
  "part_number": "STM32F722RET6",
  "aliases": [
    "STM32F722RE"
  ],
  "roadmap_phase": 0,
  "core": {
    "name": "Cortex-M7",
    "isa": "Armv7E-M",
    "word_bits": 32,
    "count": 1,
    "fpu": "single",
    "max_frequency_hz": 216000000
  },
  "package": {
    "name": "LQFP64",
    "pin_count": 64
  },
  "memory": {
    "flash_bytes": 524288,
    "sram_bytes": 262144,
    "backup_sram_bytes": 4096,
    "notes": "256 KiB system SRAM includes 64 KiB DTCM; 16 KiB ITCM and 4 KiB backup SRAM are additional regions."
  },
  "peripheral_groups": [
    "DMA",
    "ADC",
    "TIM",
    "USART",
    "SPI",
    "I2C",
    "USB",
    "SDMMC"
  ],
  "source_references": [
    {
      "title": "ST STM32F722RE product page",
      "url": "https://www.st.com/en/microcontrollers-microprocessors/stm32f722re.html"
    },
    {
      "title": "ST STM32F722RE datasheet",
      "url": "https://www.st.com/resource/en/datasheet/stm32f722re.pdf"
    },
    {
      "title": "ST RM0431 STM32F72/F73 reference manual",
      "url": "https://www.st.com/resource/en/reference_manual/rm0431-stm32f72xxx-and-stm32f73xxx-advanced-armbased-32bit-mcus-stmicroelectronics.pdf"
    },
    {
      "title": "ST AN4667 STM32F7 system architecture and performance",
      "url": "https://www.st.com/resource/en/application_note/an4667-protecting-the-code-and-data-stored-in-the-internal-flash-and-sram-of-stm32f4-series-arm-based-microcontrollers-stmicroelectronics.pdf"
    }
  ],
  "source_verified_fields": [
    "identity",
    "core",
    "word_bits",
    "frequency",
    "package",
    "flash",
    "SRAM",
    "backup_SRAM",
    "architecture_capabilities",
    "memory_regions"
  ],
  "generation_available": false,
  "record_note": "Selected F7 single-core M7 variant; headline facts only. No pin mux, DMA routing or clock tree is asserted.",
  "resources": {
    "architecture": {
      "word_bits": 32,
      "dsp_simd": true,
      "dcache": true,
      "icache": true,
      "mpu": true,
      "dwt": true,
      "hw_divide": true,
      "cmsis_dsp": true,
      "capabilities": [
        "armv7e-m",
        "thumb-2",
        "dsp",
        "hardware-divide",
        "memory-protection-unit",
        "instruction-cache",
        "data-cache"
      ]
    },
    "memory_regions": {
      "program_flash": {
        "origin": 134217728,
        "length_bytes": 524288,
        "kind": "embedded_flash",
        "notes": "Main flash base is 0x08000000. Bank, sector, bootloader, and secure/non-secure alias layout are not represented here; do not use this partial entry as a linker or flash plan."
      },
      "dtcm_ram": {
        "origin": 536870912,
        "length_bytes": 65536,
        "kind": "dtcm_sram",
        "notes": "64 KiB DTCM at 0x20000000; keep distinct from SRAM1/2 and verify each DMA master before placement."
      },
      "sram1": {
        "origin": 536936448,
        "length_bytes": 180224,
        "kind": "sram",
        "notes": "176 KiB SRAM1 at 0x20010000."
      },
      "sram2": {
        "origin": 537116672,
        "length_bytes": 16384,
        "kind": "sram",
        "notes": "16 KiB SRAM2 at 0x2003C000."
      },
      "itcm_ram": {
        "origin": 0,
        "length_bytes": 16384,
        "kind": "itcm_sram",
        "notes": "16 KiB instruction TCM; address 0 is boot-mapped and must not be treated as ordinary SRAM without validating boot remap."
      },
      "backup_sram": {
        "origin": 1073889280,
        "length_bytes": 4096,
        "kind": "backup_sram",
        "notes": "4 KiB backup SRAM at 0x40024000; separately powered/retained region."
      }
    }
  }
}
